E06.3, тиреоидит на хашимото във фаза на хипотиреоидизъм-некомпенсиран 
E06.3," тиреоидит на хашимото - хипотиреоидна фаза, "
E06.3, тиреоидит на хашимото/ еутиреоидна фаза / 
E06.3," тиреоидит на хашимото - нодозен вариант, еутиреоидна фаза. рбс "
E06.3, тиреоидит на хашимото - еутироидна фаза 
E06.3, тиреодитис хашимото в еутиреоидна фаза 
E06.3, тиреоидит на хашимото - хипотиреоиднафаза 
E06.3, тиреоидит на хашимото - субкомпенсиран хипотиреоидизъм 
E06.3, тиреоидит на хашимото -еутиреоидна фаза 
E06.3," тиреоидит на хашимото - хипотиреоидна фаза, субкомренсиран "
E06.3," тиреоидит на хашимото - хипотиреоидна фаза, медикаментозно компенсиран "
E06.3," тиреоидит на хашимото-нодозна форма, хипотиреоидна фаза "
E06.3, тиреодит на хашимото 
E06.3," тироидит на хашимото- нодозен вариант, хипотиреоидна фаза, компенсиран "
E06.3, тиреоидит на хашимото-еутиреоидна фаза. пкяб 
E06.3," тиреоидит на хашимото-нодозен вариант, еутиреоидна фаза, имунологично неактивен "
E06.3," тиреоидитис хашимото - нодозен вариант, хипотиреоидна фаза, компенсата "
E06.3," тиреоидит на хашимото - нодозен вариант, еутиреоидна фаза. обс "
E06.3, тиреоидит на хашимото - еутиероидна фаза 
E06.3, струма хашимото- нодозен вариант в еутиреоидна фаза 
E06.3, тиреоидитис хашимото- компенсирано състояние 
E06.3," тиреоидит на хашимото- нодозна трансформация, еутиреоидна фаза "
E06.3, тиреоидит на хашимото - субклиничен хипотиреодизъм 
E06.3," струма хашимото- нодозен вариант грІб/, в субклиничен хипотиреоидизъм "
E06.3," тиреоидит на хашимото-еутиреоидна фаза, нодозна форма "
E06.3, тиреоидит на хашимото- нодозна форма 
E06.3, тиреоидит на хашимото в хипотиреоидна фаза 
E06.3, тиреодит на хашимото-еутиреоидна фаза. ибс 
E06.3," тиреоидит на хашимото - атрофичен вариант, хипотиреоидна фаза, компенсиран "
E06.3," тиреоидит на хашимото - нодозен двариант, хипотиреоидна фаза, "
E06.3," тиреоидит на хашимото - нодозен вариант, фаза на субклиничен хиперпаратиреоидизъм "
E06.3, тиреоидитис хашимото в хипотиреоидна фаза- компенсиран 
E06.3, тиреодиит на хашимото-еутиреоидна фаза 
E06.3, тиреоидитис хашимото - нодозен вариант в еутиреоидна фаза 
E06.3," тиреодит на хашимото- нодзен вариант, еутиреоидна фаза "
E06.3," тиреоидит на хашимото - нодозен вариант, хипотиреоидна фаза "
E06.3, атз - тиреоидит на хашимото - хипотиреоидна фаза 
E06.3, тиреоидит на хашимото -еутиероидна фаза 
E06.3, тиреоидит на хашимото- в компенсиран хипотиреоидизъм 
E06.3, тиреоидит на хашимото- субклиничен хипертиреоидизъм 
E06.3," тиреоидит на хашимото- нодозен вариант, хипотиреоидна фаза "
E06.3," тиреоидит на хашимото, хипотиреоидна фаза, медикаментозно компенсиран "
E06.3," тиреоидит на хашимото- нодозен вариант, първичен хипотиреоидизъм "
E06.3," тиреоидитис хашимото, в еутиреоидна фаза "
E06.3, тиреоидт на хашимото - еутиреоидна фаза 
E06.3, тиреоидит на хашимото - фаза на субклиничени хипотиреоидизъм 
E06.3, струма нодоза (хашимото?) - еутиреоидна форма 
E06.3, струма нодоза хашимото гр 1б/ в еутиреоидна фаза 
E06.3, тиреоидитис хашимото- нодозен вариант в еутиреоидна фаза 
E06.3," тиреоидит на хашимото - нодозен вариант, фаза на компенсиран хипотиреоидизъм "
E06.3, тиреодитис хашимото в субклиничен хипотиреоидизъм 
E06.3, тиреодит на хашимото- субклиничен хипотиреоидизъм 
E06.3," тиреоидит на хашимото-нодозна форма, фаза на компенсиран хипотиреоидизъм "
E06.3, тиреоидит на хашимото-хипотиреоидизъм 
E06.3," тиреоидит на хашимото, хипотиреоидна фаза - медикаментозно компенсиран "
E06.3," тиреоидит на хашимото - хипотиреоидна форма, субкомпенсиран "
E06.3, тиреоидитис хашимото в еутиреоидна фаза. арт 
E06.3," тиреоидит на хашимото, хипотиреоидизъм "
E06.3, тиреоидит на хашимото във фаза на хипотиреоидизъм - компенсиран 
E06.3," тиреоидит на хашимото - атрофичен вариант, фаза на субклиничен хипотиреоидизъм "
E06.3," тиреоидит на хашимото, хипотиреоидна фаза, медикаментозно компенсирана "
E06.3," тиреоидит на хашимото, субклиничен хипотиреоидизъм "
E06.3," тиреоидитис хашимото, еутиреоидна фаза "
E06.3, тиреоидит на хашимото хипотиреоидна фаза 
E06.3," тиреоидит на хашимото, хипотиреоидна фаза, некомпенсиран "
E06.3, тиреоидит на хашимото-нодозен вариант 
E06.3," тиреоидит на хашимото - нодозен вариант, хипотиреоидна фаза, копенсиран "
E06.3, тиреоидитис хашимото - хипотиреоидна фаза- некомпенсирано състояние 
E06.3, тиреоидит на хашимото-еутиреоиден стадий 
E06.3," тиреоидит на хашимото, хипотиреоидна фаза-компенсиран "
E06.3, тиреоидит на хашимотохипотиреоидна фаза 
E06.3," тиреоидит на хашимото - нодозенвариант, еутиреоидна фаза "
E06.3, струма на хашимото - нодозен вариант 
E06.3," тиреоидитис хашимото в хипотиреоидна фаза, непълна компенсация "
E06.3, тиреоидит на хашимото- хипотиреодина фаза 
E06.3, тиреоидит на хашимото- компенсиран хипотиреоидизъм 
E06.3, тиреоидитис хашимото- в еутиреоидна фаза 
E06.3, струма нодоза хашимото гр 1б/ еутиреоидес 
E06.3, тиреодитис хашимото в хипотиреоидна фаза- компенсиран 
E06.3, тиреоидит на хашимото във фаза на хипотиреоидизъм-компенсиран 
E06.3, тиреоидит на хашимото- нодозен вариант-хипотиреоидизъм 
E06.3," тиреоидит на хашимото- нодозен вариант, във фаза на субклиничен хипотиреоидизъм, субкомпенсиран "
E06.3," тиреоидит на хашимото, еутиреоидна фазаX хидроксилазен дефицит, късна форма, частичен ензимин дефект "
E06.3," тиреоидит на хашимото- хипотиреоидна фаза, медикаментозно компенсиран "
E06.3, тиреоидит на хашимото обс идиопатичен едем 
E06.3," тиреоидит на хашимото- еутиреоидна фаза, имунологично негативен "
E06.3," тиреоидит на хашимото- нодозен вариант, хипотиреоидна фаза, имунологично активен "
E06.3," струма на хашимото, еутиероидна фаза "
E06.3, тиреоидит на хашимото нодозен вариант еутиреоидна фаза 
E06.3, тиреоидит на хашимото -хипотиреоидна фаза 
E06.3, тиреоидит на хашимото / хипотиреоидна фаза/ 
E06.3, тиреоидит на хашимото - декомпенсиран 
E06.3, тиреоидит на хашимото-хипотиреоиден стадий 
E06.3," тиреоидит на хашимото, нодозен вариант-еутиреоидна фаза "
E06.3, тиреоидит на хашмото-еутиреоиден стадий 
E06.3, тиреоидит на хашимото- във фаза на субклиничен хипотиреоидизъм- компенсиран 
E06.3," тиреоидит на хашимото - хипотиреоидна фаза, нодозен вариант "
E06.3," тиреоидит на хашимото, нодозен вариант - еутиреоидна фаза "
E06.3," тиреоидит на хашимото, хипотиреоидна фаза. хобб "
E06.3," тиреоидит на хашимото - нодозен вариант, еутиреоидно състояние "
E06.3," тиреоидит на хашимото - еутиреоидна фаза, имунологично неактивен "
E06.3, тиреоидит на хашимото- еутиреоидна фаза. пкос 
E06.3, тиреоидит на хашимото във фаза на хипотиреоидизъм-субкомпенсиран 
E06.3," тиреоидит на хашимото, нодозен вариант - хипотиреоидна фаза. ах гр. ?? "
E06.3, тиреоидит на хашимото - хиптиреодина фаза 
E06.3," струма на хашимото - нодозен вариант, хипотиреоидна фаза "
E06.3," тиреоидит на хашимото, хипотиреоидна фаза, нодозен вариант "
E06.3, тиреодити на хашимото- медикаментозен хипотиреоидизъм 
E06.3, тиреоидит на хашимото- хипертиреоиден стадий 
E06.3, тиреоидт на хашимото- хипотиреоидизъм 
E06.3, тиреодит на хашимото- хипотиреоидизъм 
E06.3, тиреоидит на хашимото - фаза на субклиничен хипертиреоидизъм 
E06.3," тиреоидит на хашимото - нодозен вариант, фаза на субклиничен хипертиреоидизъм "
E06.3, тиреоидит хашимото - хипотиреоидизъм 
E06.3, тиреоидит на хашимото - компенсиран хипотиреоидизъм 
E06.3, тиреоидит на хашимото - нодозен вариант - субкомпенсиран хипотиреоидизъм 
E06.3," тиреоидит на хашимото- нодозен вариант, еутиреоидно състояние "
E06.3," тиреоидит на хашимото - хипотиреоидна фаза, имунологично активен "
E06.3, тиреоидит на хашимото - нодозен вариант- еутиреоидна фаза 
E06.3, тиреоидит на хашимото - нодозен вариант (субкомпенсиран токсичен аденом) 
E06.3," тиреоидит на хашимото - с нодозна трансформация, фаза на субклиничен хипотиреоидизъм "
E06.3," тиреоидит на хашимото- нодозен вариант, имунологично активен, еутиреоидна фаза "
E06.3," тиреоидит на хашимото, хипотиреоидна фаза, компенсиран "
E06.3, тиреоидит на хашимото - нодозен вариант - субклиничен хипотиреоидизъм 
E06.3, тиреоидит на хашимото - некомпенсиран хипотиреоидизъм 
E06.3," тиреоидит на хашимото - хипотиреоидна фаза, субкомпенсиран "
E06.3, тиреоидит на хашимото-компенсиран субклиничен хипотиреои-дизъм 
E06.3, тиреоидит на хашимото-нодозен вариант в еутиреоиден стадий 
E06.3, тиреоидит на хашимото-нодозен вариант-субкомпенсиран хипотиреои-дизъм 
E06.3," тиреоидит на хашишомото - нодозен вариант, болкова форма в субклиничен хипотиреоидизъм "
E06.3," тиреоидит на хашимото- еутиреоидна фаза, имунологично активен "
E06.3, тиреоидит на хашимото - нодозен вариант-еутиреоидна фаза 
E06.3, тиреоидит на хашимото - нодозен вариант - еутиреоидна фаза
E06.3," тиреоидит на хашимото-нодозен вариант, еутироидна форма "
E06.3," тиреоидит на хашимото - нодозеан вариант, еутиреидна фаза "
E06.3," тиреоидит на хашимото, еутироидна фаза "
E06.3, тиреоидит на хашимото с нодозна трансформация- еутиреоидна фаза 
E06.3, тиреоидит на хашимото - нодозен вариант- компенсиран хипотиреои-дизъм 
E06.3, тиреоидит на хашимото - нодозен вариант- компенсиран хипотиреоидизъм 
E06.3," тиреоидит на хашимото-нодозен вариант в хипотиреоиден стадий, компенсиран "
E06.3," тиреоидит на хашимото, хипотиреоидна фаза, струмозна форма "
E06.3," тиреоидит на хашимото, нодозен вариант в еутиреоидна фаза "
E06.3," тиреодит на хашимото- нодозен вариант, компенсиран хипотиреои-дизъм "
E06.3," тиреоидит на хашимото-нодозен вариант, фаза на медикаментозен хипотиреоидизъм "
E06.3, тиреоидит на хшимото- еутиреоиден стадий 
E06.3," тироидит на хашимото, еутироидна фаза, нодозна форма "
E06.3," триеоидит на хашимото-хипотиреоидна фаза, непълна медикаментозна компенсация "
E06.3, тиреоидит на хашимото- нодозен вариант в еутиреоиден стадий 
E06.3," тиреоидит на хашимото- нодозен вариант, еутиреоиден стадий "
E06.3," тиреоидит на хашимото-нодозен вариант, хипертиреоидна фаза, в терапевтична ремисия "
E06.3, тиреоидит на хашимото в хипотиреоиден стадий 
E06.3," тиреоидитис хашимото- нодозен вариант, в еутиреоидна фаза "
E06.3," тиреодит на хашимото, хипотиреоидна фаза "
E06.3," струма хашимото- нодозен вариант, в субклиничен хипотиреоидизъм "
E06.3, тиреоидит на хашимото- в хипотиреоиден стадий-компенсиран 
E06.3, струма хашимото нодозен вариант в еутиреоидна фаза 
E06.3, тиреоидит на хашимото - еутиреоиден стадий 
E06.3," тиреоидит на хашимото - нодозен вариант, еутиреоиден стадий "
E06.3, тиреоидит на хашимото-еутиреоиден вариант 
E06.3," тиреоидитис хашимото в хипотиреодна фаза, некомпенсирано състояние "
E06.3, нодозен вариант на тиреоидит на хашимото- еутиреоидна фаза 
E06.3," тиреоидит на хашимото-хипертиреоидна фаза(амиодарон индуцирана), в терапевтична ремисия "
E06.3," тиреоидит на хашимото - фаза на субклиничен хипотиреоидизъм, компенсиран "
E06.3," тиреоидит на хашимото, хипотиреоиден стадий "
E06.3," тиреоидит на хашимото - хипотиреоидна фаза, компнсиран "
E06.3, тиреоидит на хашимото- фаза на субклиничен хипотиреоидизъм 
E06.3, тиреоидит на хашимото-субклиничен хипотиреоидизъм 
E06.3," тиреоидит на хашимото-хипотиреоидна фаза, компенсиран "
E06.3, тиреоидит на хашимото с нодозна трансформация 
E06.3," тиреоидит на хашимото- хипотиреоидна фаза, имунологично активен "
E06.3, тиреоидит на хашимото- еутиреоиден стадий 
E06.3," тиреоидит на хашимото, хипертиреоидна фаза, непълна терапевтична ремисия "
E06.3," тиреоидит на хашимото-нодозен вариант ,еутиреоидна фаза "
E06.3, тиреоидит на хашимото-нодозен вариант-хипотиреоиден стадии 
E06.3," струма хашимото с нодозна трансформация, в еутиреоидна фаза "
E06.3," тиреоидит на хашимото-нодозен вариант, хипертиреоидна фаза (йодиндуцирана) "
E06.3, тиреоидитис хашимото в еутиреоидна фаза. вит 
E06.3," тиреоидит на хашимото, нодозен вариант,еутиреоидна фаза "
E06.3, тиреоидит на хашимото- хипотиреоиден стадий 
E06.3," тиреоидит на хашимото - нодозен вариант, хипотиреоидна фаза-компенсиран "
E06.3," тиреоидит на хашимото, нодозна форма "
E06.3," тиреоидит на хашимото-нодозен вариант, хипертиреоидна фаза, начална терапевтична ремисия "
E06.3, тиреоидит на хашимото- хипотиреоиден стадии 
E06.3, тиреоидит на хашимото с нодозна трансформация - еутиреоидна фаза 
E06.3," тиреоидит на хашимото-нодозен вариант, хипертиреоидна фаза "
E06.3, тиреоидит на хашимото - нодозен вариант хипотиреоидизъм 
E06.3," тиреоидит на хашимото, хипотиреоидна фаза, медикаментозно субкомпенсиран "
E06.3, тиреоидит на хашимото нодозен вариант 
E06.3, тиреоидит на хашимото - хипотиреоидизъм компенсата 
E06.3, тиреоидит на хашимото - с нодозна трансформация
E06.3, тиреоидит на хашимото -хипотиреоиден стадий 
E06.3, поради хашитоксикоза с хроничнорецидивиращо протичане 
E06.3, тиреоидит на хашимото-нодозен вариант в еутиреоидна фаза 
E06.3," тиреоидит на хашимото - с нодозна трансформация, в еутиреоидна фаза "
E06.3," тиреоидит на хашимото - нодозен вариант, в еутиреоидна фаза "
E06.3," тиреоидитис хашимото в хипотиреоидна фаза, начална компенсация "
E06.3, тиреоидит на хашимото -нодозен вариант 
E06.3," тиреоидит на хашимото- нодозен вариант, имунологично негативен, еутиреоиден стадий "
E06.3, тиреоидит на хашимото в еутиреоидна фаза 
E06.3," тиреоидит на хашимото- нодозен вариант, в еутиреоиден стадий "
E06.3," тиреоидитис хашимото- нодозен вариант в хипотиреоидна фаза, компенсирано състояние "
E06.3, тиреоидит на хашимото - хипотилеоидна фаза 
E06.3, тиреоидит на хашимото - нодозен вариант - в хипотиреоидна фаза 
E06.3," тиреоидит на хашимото - хипотиреоидна фаза, компенсирана "
E06.3, тиреоидит на хашимото -еутиреоиден стадии 
E06.3, тиреоидит на хашимото имунологично негативен- еутиреоиден стадий 
E06.3, тиреоидит на хашимото -нодозен вариант
E06.3," тиреоидитис хашимото- в хипотиреоидна фаза, непълна компенсация "
E06.3, тиреоидит на хашимото - нодозен вариант- хипотиреоидна фаза 
E06.3," тиреоидит на хашимото-имунологично негативен, хипотиреоиден стадий "
E06.3," тиреоидит на хашимото, еутиреоиден стадий "
E06.3," тиреоидитис хашимото в хипотиреоидна фаза, компенсирано състояние "
E06.3," тиреоидит на хашимото имунологично негативен вариант, хипотиреоиден стадий "
E06.3," тиреоидит на хашимото- имунологично негативен, хипотиреоиден стадии "
E06.3, тиреоидит на хашимото- нодозна трансформация 
E06.3," тиреодит на хашимото - болкова форма, фаза на субклиничен хипертиреодизъм "
E06.3," тиреоидит на хашимото-нодозен вариант, хипертиреоидна фаза , начална терапевтична ремисия "
E06.3, тиреоидитис хашимото- във фаза на субклиничен хипотиреоидизъм 
E06.3," тиреоидит на хашимото- нодозен вариант, имунологично негативен, хипотиреоиден стадий "
E06.3," тиреоидит на хашимото - нодозен вариант, в компенсиран хипотиреоидизъм "
E06.3," тиреоидит на хашимото, състояние след парциална резекция на щитовидната жлеза, хипотиреоидизъм, медикементозно компенсиран "
E06.3," тиреоидит на хашимото- нодозен вариант, в компенсиран хипотиреоидизъм "
E06.3," тиреоидит на хашимото- нодозен вариант, имунологично негативен- хипотиреоиден стадий "
